SKU,Brand,Description,UOM,MRP,Slab_1_Margin,Slab_1_SP_Excl_Tax,PCS/PK,Slab_2_Margin,Slab_2_SP_Excl_Tax,Slab_3_Margin,Slab_3_SP_Excl_Tax,Slab_4_Margin,Slab_4_SP_Excl_Tax,Slab_5_Margin,Slab_5_SP_Excl_Tax,GST,sale_qty,String1,String2
100806011684,WORKSTORE,"EASY Fine Tip Ball Pen, Blue, 5 pcs/pack",PACK,30,46,25,5,40,22.5,32.5,20,25,18,25,18,GST-18,125530,"['EASY Fine Tip Ball Pen, Blue, 5 pcs/pack']","['EASY Fine Tip Ball Pen, Blue, 5 pcs/pack', 'BALL PEN LEXI', 'PEN', 'Natraj Pens', 'Lexi Pen Black', 'Pen packt', 'EASY Fine Tip Ball Pen, Blue, 5 pcs/pack (PAC)', 'Pen Lexi - (Pack of 10)', 'Laxi Ball Pen', 'Rorito Ball Pen', 'Lexi Ball Pen All Color', 'Lexi Ball Pen All Colour', 'Easy Pens Blue', 'Blue Pens', 'Ball Pen, Omega Magic Tip, Top Cap, Colour Blue', 'Ball Pen', 'Pen Ball Lexi - Blue', 'LEXI PEN (Blue)', 'Blue pen Lexi 1 packet 10 pcs)', 'Lexi Ball Pen', 'Lucky ball pen', 'Ball Pen Lexi']"
100806011685,WORKSTORE,"EASY Fine Tip Ball Pen, Black,, 5 pcs/pack",PACK,30,46,25,5,40,22.5,32.5,20,25,18,25,18,GST-18,28879,"['EASY Fine Tip Ball Pen, Black,, 5 pcs/pack']","['Ball Pen, Omega Magic Tip, Top Cap, Colour Black', 'Black pen Lexi (1 packet 10 pcs)', 'EASY Fine Tip Ball Pen, Black,, 5 pcs/pack (PAC)', 'Pen Ball Lexi - Black', 'EASY Fine Tip Ball Pen, Black,, 5 pcs/pack', 'BLACK PEN', 'Pen']"
100806011686,WORKSTORE,"EASY Fine Tip Ball Pen, Red, 5 pcs/pack",PACK,30,46,25,5,40,22.5,32.5,20,25,18,25,18,GST-18,7567,"['EASY Fine Tip Ball Pen, Red, 5 pcs/pack']","['Easy Pens Red', 'Red pens', 'Pen Ball Lexi - Red', 'Ball Pen, Omega Magic Tip, Top Cap, Colour Red', '3. Red ball pen :- 100 No', 'EASY Fine Tip Ball Pen, Red, 5 pcs/pack (PAC)', 'EASY Fine Tip Ball Pen, Red, 5 pcs/pack']"
100806010069,LINC,LINC GLYCER BALL PEN; 0.6 MM; BLUE; 5 PCS/PACK,PACK,50,19.05,42,5,15,40,15,40,15,40,15,40,GST-18,21247,['LINC GLYCER BALL PEN; 0.6 MM; BLUE; 5 PCS/PACK'],['LINC GLYCER BALL PEN; 0.6 MM; BLUE; 5 PCS/PACK']
100806010068,LINC,LINC GLYCER BALL PEN; 0.6 MM; BLACK; 5 PCS/PACK,PACK,50,19.05,42,5,15,40,15,40,15,40,15,40,GST-18,664,['LINC GLYCER BALL PEN; 0.6 MM; BLACK; 5 PCS/PACK'],['LINC GLYCER BALL PEN; 0.6 MM; BLACK; 5 PCS/PACK']
100806010027,CELLO,"Cello Fine Grip Ball Pen, 0.7 MM, Blue, 5 Pc/Pack",PACK,35,20.69,29,5,20.69,29,17.86,28,17.86,28,17.86,28,GST-18,45617,"['Cello Fine Grip Ball Pen, 0.7 MM, Blue, 5 Pc/Pack']","['FINE GRIP PEN Black Gel (Rs. 7 MRP )', 'Cello Fine Grip Ball Pen, 0.7 MM, Blue, 5 Pc/Pack', 'Fine Grip Ball Pen Colour Blue']"
100806010028,CELLO,"Cello Fine Grip Ball Pen, 0.7 MM, Black, 5 Pc/Pack",PACK,35,20.69,29,5,20.69,29,17.86,28,17.86,28,17.86,28,GST-18,16701,"['Cello Fine Grip Ball Pen, 0.7 MM, Black, 5 Pc/Pack']","['Cello Fine Grip Ball Pen, 0.7 MM, Black, 5 Pc/Pack', 'Cello Finegrip Ball Pen (Black) - 5 pcs. (Pack)', 'Fine Grip Ball Pen Colour Black']"
10051727,CELLO,CELLO TRI-MATE BALL PEN BLUE 5 PCS/ PACK of 1,PACK,30,36,25,5,36,25,36,25,27.27,22,20,20,GST-18,46164,['CELLO TRI-MATE BALL PEN BLUE 5 PCS/ PACK of 1'],"['Cello Butterflow Ball Pen', 'Monteux Pen - Blue', 'Celo Pointce Pen ( Blue )', 'Lexi Ball Pen', 'LINC GLYCER BALL PEN; 0.6 MM; BLUE; 5 PCS/PACK (PAC)', 'PEN', 'STATIONERY,PEN,BALL POINT(1PAC=5NOS)', 'Cello Pointec Gel Pen', 'CELLO PEN ( Rs. 8 MRP ) - Black / Blue / Green / Red', 'CELLO TRI-MATE BALL PEN BLUE 5 PCS/ PACK of 1', 'Ball Pen Renolds', 'BALL PEN MONTEX MEGATOP', 'LEXI PEN', 'LEXI BALL PEN BLUE', 'Technotip Ball Pen']"
10045803,CELLO,Cello Tri-mate Ball Pen Black (Pack of 5),PACK,30,36,25,5,36,25,36,25,27.27,22,20,20,GST-18,96525,['Cello Tri-mate Ball Pen Black (Pack of 5)'],"['Celo Pointce Pen ( Black )', 'LEXI BALL PEN BLACK', 'LINC GLYCER BALL PEN; 0.6 MM; BLACK; 5 PCS/PACK (PAC)', 'Cello Tri-mate Ball Pen Black (Pack of 5)', 'Cello Fine Grip Ball Pen']"
10054975,CELLO,CELLO TRI-MATE BALL PEN RED (PACK OF 5) PACK of 1,PACK,30,36,25,5,36,25,36,25,27.27,22,20,20,GST-18,1807,['CELLO TRI-MATE BALL PEN RED (PACK OF 5) PACK of 1'],"['Celo Pointce Pen ( Red )', 'LEXI BALL PEN RED', '8. Pen Red & Green', 'CELLO TRI-MATE BALL PEN RED (PACK OF 5) PACK of 1']"
100806011192,WORKSTORE,Workstore Easy sleek Ball pen blue ink (20 pcpack),PACK,80,33.33,60,20,33.33,60,28.57,56,28.57,56,23.08,52,GST-18,32827,['Workstore Easy sleek Ball pen blue ink (20 pcpack)'],"['Blue Pen (1 Packet 20 pcs)', 'Use & throw Pens Blue', 'Nataraj Pen', 'Nataraj Classic Ball Pen (Assorted Colours) - (100 pcs Jar)', 'USE & THROW PEN', 'Ball Pen Use&Trogh Natraj', 'Easy Slim Blue ink (20 pc pack ) {Use & Throw Pen} (PAC)', 'BALL PEN USE & THROW', 'Ball Pen Use&Trogh', 'BALL PEN NATARAJ BLUE', 'BLUE PEN USE & Throw', 'Pen Blue (Natraj/Starflow) 20 no. Use & Through', 'Use & Throw Ball Pen ( 1 Pkt = 20 Pcs )', 'Pen (Natraj/Starflow) 20 no. Use & Through', 'Ball pen (Use and throw)', 'Use & Throw Ball Pen', 'Ball Pen', '4. Easy slim blue pen (Use & throw pen) :- 500 No', 'Blue Pen (MRP 3 Rs)', 'BLACK PEN USE & Throw', 'U&T PEN-NATRAJ', 'Natraj PEN (USE AND THROW) 20 pen', 'Lucky ball pen', 'Lexi Pen', 'Ball Pen (Use&Throw) Blue', 'Ball Pen Use & Throw', 'Ball pen', 'Workstore Easy sleek Ball pen blue ink (20 pcpack)', 'Natraj Classic Pen', 'USE & THROW PEN (LINC) - Black / Blue / Green / Red']"
100806011400,WORKSTORE,Workstore Easy sleek Ball pen black ink (20 pcpack),PACK,80,33.33,60,20,33.33,60,28.57,56,28.57,56,23.08,52,GST-18,13399,['Workstore Easy sleek Ball pen black ink (20 pcpack)'],"['Easy Slim Black ink (20 pc pack ) {Use & Throw Pen} (PAC)', 'Pen Black (Natraj/Starflow) 20 no. Use & Through', 'BALL PEN NATARAJ BlACK', 'BALL PEN NATRAL CLASSIC', 'Black pen 1 Packet 20 ocs)', 'Workstore Easy sleek Ball pen black ink (20 pcpack)', 'Ball Pen (Use&Throw) Black']"
10057913,CELLO,CELLO GRIPPER BALL PEN BLUE INK 0.5MM (PACK OF 10 PCS),PACK,100,31.25,80,10,31.25,80,26.67,75,26.67,75,26.67,75,GST-18,61484,['CELLO GRIPPER BALL PEN BLUE INK 0.5MM (PACK OF 10 PCS)'],"['Cello Gripper Ball Pen, 0.5 MM, Blue, 5 Pc/Pack (PAC)', 'CELLO GRIPPER BALL PEN BLUE INK 0.5MM (PACK OF 10 PCS)', '4. Cello Gripper Blue pen :- 500 No', 'Pen - Cello Gripper - Blue', 'Cello Gripper (Blue)', 'BALL PEN CELLO GRIPER', 'Cello Gripper Pen Blue']"
10057914,CELLO,CELLO GRIPPER BALL PEN BLACK INK 0.5MM (PACK OF 10 PCS ),PACK,100,31.25,80,10,31.25,80,26.67,75,26.67,75,26.67,75,GST-18,3264,['CELLO GRIPPER BALL PEN BLACK INK 0.5MM (PACK OF 10 PCS )'],"['Cello Gripper Ball Pen, 0.5 MMM, Black, 5 Pc/Pack (PAC)', 'CELLO GRIPPER BALL PEN BLACK INK 0.5MM (PACK OF 10 PCS )', 'Pen - Cello Gripper - Black', '5. Cello Gripper Black Pen:- 500 No']"
10051735,CELLO,CELLO SUPER STAR GEL PEN BLACK (PACK of 5),PACK,30,24,25,5,28.03,26.4,24,25,24,25,24,25,GST-12,4967,"['CELLO SUPER STAR GEL PEN BLACK (PACK of 5)', 'CELLO SUPER STAR/ MY GEL PEN BLACK (PACK of 5)']","['GEL PEN-BL', 'Pen Gel (Black)', 'CELLO SUPER STAR GEL PEN BLACK (PACK of 5)', 'Rorito Fasty Gel Pen', 'LINC OCEAN GEL PEN; 0.5 MM; BLACK; 5 PCS/PACK (PAC)', 'Gel Pen ( Rs. 7 MRP ) - Black / Blue / Green / Red', 'CELLO SUPER STAR /MY GEL PEN BLACK (PACK of 5)', 'Pen Cello Flogel - Black']"
10051734,CELLO,CELLO SUPER STAR GEL PEN BLUE (PACK of 5),PACK,30,24,25,5,28.03,26.4,24,25,24,25,24,25,GST-12,13999,"['CELLO SUPER STAR GEL PEN BLUE (PACK of 5)', 'CELLO SUPER STAR/ MY GEL PEN BLUE (PACK of 5)']","['Rorito Flymax Gel Pen', 'Pen Gel Blue', 'STATIONERY,PEN,GEL', 'CELLO SUPER STAR /MY GEL PEN BLUE (PACK of 5)', 'Pen Cello Flogel - Blue', 'Pen - Gel- Hauser (Black)', 'LINC OCEAN GEL PEN; 0.5 MM; BLUE; 5 PCS/PACK (PAC)', 'CELLO POINTER GEL']"
100806050323,UNIBALL,"Uniball Click Gel Pen , Blue",PCS,50,23.81,42,1,23.81,42,3.03,33,23.81,42,20,40,GST-12,15854,"['Uniball Click Gel Pen , Blue']","['3. Uniball Pen Blue', 'Uni Click Gel Pen', 'Uniball Click Gel Pen , Blue (Per Pc)', 'Uniball Click Gel Pen Blue', 'Uniball Click Gel Pen , Blue']"
100806050324,UNIBALL,"Uniball Click Gel Pen, Black",PCS,50,23.81,42,1,23.81,42,3.03,33,23.81,42,20,40,GST-12,6613,"['Uniball Click Gel Pen, Black']","['Uniball Click Gel Pen, Black', 'Uniball Click Gel Pen, Black (Per Pc)']"
100801010181,CAMLIN,Camlin All Clear Eraser Box Of 20Pcs - 5247484,PACK,60,34.62,52,20,32,50,32,50,29.17,48,26.09,46,GST-5,935,['Camlin All Clear Eraser Box Of 20Pcs - 5247484'],"['Linc Markline Erasers 20 Pcs/Pack {Apsara} (PAC)', 'NON DUST ERASER', 'APSARA NON DUST ERASER', 'Non Dust Eraser', 'Apsara Eraser Pack of 20pcs', 'Camlin All Clear Eraser Box Of 20Pcs - 5247484', 'NON DUST RUBBER', 'Camlin All Clear Eraser Box Of 20Pcs', 'Apsara Non-Dust Eraser - 20 pcs. (Pack)', 'ERASER-CREATIONS']"
100801010060,NATARAJ,"Nataraj 621 Plasto Eraser, 20 Pc/Pack",PACK,25,28.57,21,20,25,20,25,20,25,20,25,20,GST-5,8426,"['NATARAJ 621 PLASTO ERASER, (PACK OF 20)', 'Nataraj 621 Plasto Eraser, 20 Pc/Pack']","['Erazor Natraj', 'Pencil Erazer', 'Pencil Eraser Non-Dust', 'Natraj Erazer', 'Natraj Eraseer', 'Eraser', 'ERASER', 'Nataraj 621 Plasto Eraser, 20 Pc/Pack (PAC)', 'Eraser-Natraj', 'Eraser ( 1 Pkt = 20 Pcs )', 'Eraser (20 pcs in one Pkt)', 'Nataraj 621 Plasto Eraser, 20 Pc/Pack', 'STATIONERY,ERASER,PENCIL', 'ERASER ( NATRAJ RS. 1 MRP )', 'Eraser Pack of 20', 'Pencil Eraser', 'ERASER-NATRA']"
100804020001,CAMLIN,Camlin /Flair Mechanical Pencil 0.5MM -6805132,PCS,17,37.47,15,1,37.47,15,33,14,27.85,13,27.85,13,GST-12,1002,['Camlin /Flair Mechanical Pencil 0.5MM -6805132'],"['Camlin /Flair Mechanical Pencil 0.5MM -6805132', 'Klick Mechanical Pencil ( 0.5 mm)', 'Camlin Klick Pro 0.5mm Mech. Pencil -6805132 (NOS)', 'Klick Mechanical Pencil ( 0.6 mm)']"
100805020014,NATARAJ,"Nataraj 621 Pencils, HB, 10 Pcc/Pack",PACK,50,16.67,42,10,16.67,42,12.5,40,12.5,40,12.5,40,GST-12,21556,"['NATARAJ 621 PENCILS, HB, (PACK OF 10)', 'Nataraj 621 Pencils, HB, 10 Pcc/Pack']","['Pencils', 'APSARA PENCIL 6H', 'Apsara Platinum Pencil', 'Nataraj Pencil HB', 'PENCIL - NATRAJ (621)', 'Pencil Naatraj HB', 'Pencile Apsara', 'Nataraj 621 Pencils, HB, 10 Pcc/Pack', 'Natraj Pencil', 'NATARAJ PENCILS', 'PENCIL NATRAJ', 'Nataraj 621 Pencil - 10 pcs. (Pack)', 'Pencils Nataraj', 'Pencil NATRAJ 621 (PACk of 10 pencils)', 'Natraj Pencil (1 Pkt = 0 PCS )', 'Pencil', 'Pencil Natraj', 'Deep Dark Pencil Natraj', 'STATIONERY,PENCIL,CARBON', 'PENCIL', 'Natraj Pencil HB', 'Pencil Pkt', 'Nataraj 621 Be BOLD HB writing pencils']"
102102010002,KORES,KORES CLASSIC PREMIUM HB PENCILS 10 PC PACK,PACK,50,16.67,42,10,16.67,42,12.5,40,12.5,40,12.5,40,GST-12,18545,['KORES CLASSIC PREMIUM HB PENCILS 10 PC PACK'],"['KORES CLASSIC PREMIUM HB PENCILS 10 PC PACK', 'Kores Delite Pencil HB Extra dark 10 pc pack (PAC)', 'PENCILAPSARA', 'Apsara Extra Dark Pencil', 'PENCIL DOMS', 'Pencil Faber Castell', 'Apsara Platinum Pencil', 'Pencil Apsara', 'APSARA PENCIL', 'Apsara Platinum Extra Dark Pencil', 'Apsara Beauty Pencils, HB, 10 Pc']"
100209010027,STANDARD,"Stainless Steel Scale, 12 inch",PCS,32,30.77,26,1,30.77,26,28,25,28,25,25,24,GST-12,5975,"['STANDARD STAINLESS STEEL SCALE, 12 INCH', 'Stainless Steel Scale, 12 inch']","['Steel Scale camlin', 'Ruller (Steel) 12""', 'Stainless Steel Scale, 12 inch', 'STEEL SCALE', 'RULLER 12inch STEEL', 'SCALE 12"" - IRON AJANTA / ELLORA ( MRP - RS. 50/ RS. 60 )', 'STEEL SCALE 12', 'Steel Scale 12 inch Boss', 'Steel Scale', 'SS SCALE- 12""', 'Scale 12 Inch (Steel)', 'Scale Steel 30 cm', 'Scale Steel JK', 'Dash Ruler (12"", Metal) - (Unit)', 'Scale 12 inch', 'Stainless Steel Scale, 12 inch (NOS)', 'STEEL SCALE THIK']"
100209010007,CAMLIN,"Camlin Exam Plastic Scale 12""- 5248491",PCS,12,35,10,1,35,10,27.78,9,27.78,9,27.78,9,GST-12,14163,"['Camlin Exam Plastic Scale 12""- 5248491']","['Camlin Exam Plastic Scale 12""- 5248491 (NOS)', 'SCALE PLASTIC 12""', 'Plastic Scale 12”', 'Scale Plastic Star', 'PLASTIC SCALE', 'Nataraj Ruler (12"", Plastic) - (Unit)', 'Scale, 30 cms, Camlin Exam', 'Scale 12 Inch (Plastic)', 'RULER,MSRNG,TRANSPT,12IN', '12""Steel Ruller', 'SCALE 12"" - PLASTIC', 'Scale', 'Plastic Scale, Size 300 mm', 'Scales-Classic Natraj', 'SCALE STEEL', 'Camlin Exam Plastic Scale 12""- 5248491', 'Ruler- Plastic Scale 12""']"
100807010149,CAMLIN,Camlin Exam Sharpener Box Of 20Pcs - 5249488,PACK,80,30.77,65,20,30.77,65,25,60,25,60,19.64,56,GST-12,6452,['Camlin Exam Sharpener Box Of 20Pcs - 5249488'],"['Pencil Sharpener', 'Sharpener', 'STATIONERY,SHARPNER,PENCIL', 'Natraj Sharpner', 'Camlin Exam Sharpener Box Of 20Pcs - 5249488', 'NATARAJ SHARPENER', 'Sharpner Box-Natraj', 'SHAPNER APSARA', 'Linc Markline Sharpeners 20 Pcs/Pack {Natraj/Camlin} (PAC)', 'Sharpner Natraj', 'Sharpener Natraj', 'APSARA SHAPER', 'Plastic Sharpeners, Natraj, Asst Colours', 'SHARPNER PENCIL-CREATIONS', 'SHARPNER', 'SHARPNER APSARA (RS. 3 MRP )', 'Sharpner Pack of 20', 'Apsara Long Point Sharpener - 20 pcs. (Pack)', 'SHARPENER', 'Sharpner', 'Natraj Shapner', 'Natraj Sharpener']"
100705010011,CAMLIN,"Camlin Assorted Sketch Pen Set- In Pouch, 12 Pc/Pk - 404455",SET,30,32,25,1,29.17,24,29.17,24,22.73,22,22.73,22,GST-12,14341,"['Camlin Assorted Sketch Pen Set- In Pouch, 12 Pc/Pk - 404455']","['Sketch Pen Pack', 'SKETCH PEN-GREEN', 'STATIONERY,SET,SKETCH PEN', 'Camlin Assorted Sketch Pen Set- In Pouch, 12 Pc/Pk - 404455 (PAC)', 'sketch pens (small sized)', 'Sketch Pen Luxor', 'Sketch pen pkt', 'SKETCH PEN SET', 'Camlin Assorted Sketch Pen 12 Pcs - (Pack)', 'Sketch Pen', 'Sketch pens multicolor', 'Camlin Assorted Sketch Pen Set- In Pouch, 12 Pc/Pk - 404455', 'SKETCH PEN BLACK-LUXOR', 'Camlin Assorted Sketch Pen Set- In Pouch, 12 Pc/Pk', 'Sketch pens']"
100803010003,CAMLIN,Camlin Hi-Lighter Marker Pen Assorted 5 Pc/Set 7287001,SET,125,44.5,100,5,42.19,96,41.58,95,38.33,90,34.71,85,GST-12,5758,['Camlin Hi-Lighter Marker Pen Assorted 5 Pc/Set 7287001'],"['Highlighter', 'Camlin Highlighter (Assorted) - (Pack of 5)', 'Camlin Hi-Lighter Marker Pen Assorted 5 Pc/Set 7287001', 'Camlin Hi-Lighter Marker Pen Assorted 5 Pc/Set', 'Camlin Hi-Lighter Marker Pen Assorted 5 Pc/Set 7287001 (SET)']"
100803010004,CAMLIN,"Camlin Hi-Lighter Marker Pen, Yellow - 7287130",PCS,25,45.24,21,1,42.5,20,39.47,19,36.11,18,32.35,17,GST-12,5069,"['Camlin Hi-Lighter Marker Pen, Yellow - 7287130']","['Highlighter Colour', 'Camlin Hi-Lighter Marker Pen, Yellow - 7287130', 'Camlin Highlighter', 'HIGHLIGHTER BLACK', 'Camlin Hi-Lighter Marker Pen, Yellow - 7287130 (Nos)', 'Highlighter Pen Chisel Tip Colour Yellow']"
10046050,WORKSTORE,Workstore Yellow Highlighter W105 1 Pc,PCS,20,50,16,1,46.67,15,42.86,14,38.46,13,38.46,13,GST-12,21558,['Workstore Yellow Highlighter W105 1 Pc'],"['Highlighter Pen', 'Highlighters', 'Highlighter', 'HIGHLIGHTER PEN-KORES', 'HIGHLIGHT MARKER PEN ORANGE CAMLIN', 'Highlighter Colour', 'Workstore Yellow Highlighter W105 1 Pc', 'Highligher', 'Highliter Pen', 'HIGHLIGHTER MARKER', 'HIGHLIGHTER', 'HIGH LIGHTER', 'Hilighter Yellow color special']"
102105010029,WORKSTORE,Workstore Assorted Color Highllighter - 5 PCS,SET,100,49.41,85,5,46.25,80,42.67,75,38.57,70,38.57,70,GST-12,5457,['Workstore Assorted Color Highllighter - 5 PCS'],"['HIGHLITE MARKER SET LUXER', 'Workstore Assorted Color Highllighter - 5 PCS', 'Highlighter', 'Highlighter Camlin All colour 1 pcs)', 'Luxor Chisel Markers Assorted Colors - (Pack of 10)', 'Highlighter Colour', 'Hilighter boxes camlin', 'Highlighter Set Faber Castle', 'Highlighter Multi Colour', 'Pen Highlighter Pen Pack of 5 pcs', 'Textliner, Highlighter,(1PAC=5NOS)', 'Highlighter (1 Pkt = 5 Pcs )', 'Highlighter Colours']"
100803030122,CAMLIN,Camlin CD Dvd Marker Pen Black - 7289016,PCS,10,32.12,8.25,1,32.12,8.25,32.12,8.25,32.12,8.25,30,8,GST-12,56171,['Camlin CD Dvd Marker Pen Black - 7289016'],"['OHP MARKER BLACK-LUXOR', 'CD Marker Pen -Luxor-10 pcs', 'Marker Permanent, CD/DVD(1PAC=10NOS)', 'Permanent CD Marker Pen', 'Camlin CD Dvd Marker Pen All colors', 'OHP / CD MARKER', 'CD Marker', 'C D Marker', 'Faber Castell CD Marker', 'CD Marker Black', 'Camlin CD Dvd Marker Pen Black - 7289016 (Nos)', 'OHP Marker Faber Castell', '6. CD Markar Red,Green,Blue', 'OHP MARKER', 'Permanent Marker Pen 10 pcs - Luxor', 'CD Marker Pen', 'DC/OHP MARKER', 'Camlin CD - DVD Permanent Marker Fine Pen - Pack of 2 Assorted Colors (Black & Blue)', 'OHP CD Marker Black', 'OHPMarker,Camlin, Black', 'Camlin CD/DVD Marker (Black) - 10 pcs. (Pack)', 'CD MARKER - Black / Blue / Green / Red', 'Camlin CD Dvd Marker Pen Black - 7289016', 'Cd Marker']"
100803030123,CAMLIN,Camlin CD Dvd Marker Pen Blue - 7289018,PCS,10,32.12,8.25,1,32.12,8.25,32.12,8.25,32.12,8.25,30,8,GST-12,10305,['Camlin CD Dvd Marker Pen Blue - 7289018'],"['OHP CD Marker Blue', 'CD Marker Camlin', 'Pen - CD/DVD OHP Marker', 'OHP Marker Camls', 'Ohp C D Marker', 'OHP / CD MARKER', 'CD Marker Luxor', 'Camlin CD/DVD Marker (Blue) - 10 pcs. (Pack)', 'OHP MARKER', 'C D Marker', 'Faber Castell CD Marker', 'Camlin CD Dvd Marker Pen Blue - 7289018', 'OHP Marker']"
100803030125,CAMLIN,Camlin CD Dvd Marker Pen Green - 7289175,PCS,10,32.12,8.25,1,32.12,8.25,32.12,8.25,32.12,8.25,30,8,GST-12,2635,['Camlin CD Dvd Marker Pen Green - 7289175'],"['Camlin CD Dvd Marker Pen Green - 7289175', 'OHP CD Marker Green']"
100803030124,CAMLIN,Camlin CD Dvd Marker Pen Red - 7289369,PCS,10,32.12,8.25,1,32.12,8.25,32.12,8.25,32.12,8.25,30,8,GST-12,8910,['Camlin CD Dvd Marker Pen Red - 7289369'],"['CD Marker Red', 'Camlin CD Dvd Marker Pen Red - 7289369', 'OHP CD Marker Red', 'Camlin CD Dvd Marker Pen Red - 7289369 (Nos)']"
100803050008,CAMLIN,"Camlin Permanent Marker, Plastic Body, Black - 7270016",PCS,20,32.35,17,1,32.35,17,28.13,16,28.13,16,23.33,15,GST-12,198810,"['Camlin Permanent Marker, Plastic Body, Black - 7270016']","['Permanent marker big Black', 'Camlin Permanent Marker, Plastic Body, Black - 7270016 (Nos)', 'Permanent Marker - Black / Blue / Green / Red', 'Parmanent Markar Pen', 'PERMANENT MARKER BLACK', 'Permanent Marker thick', 'Pernment Marker', 'STATIONERY,MARKER,PERMANENT', 'PERMANENT MARKER', 'PERM.MARKER RED-LUXOR', 'Camlin Permanent Marker (Black) - (Pack of 10)', 'Permanent Markar Black Ink camlin 500 ML', 'Permanent Marker Luxor', 'PERM.MARKER BK-LUXOR', 'Camlin Permanent Marker, Plastic Body, Black', 'Permanant Marker', 'Permanent Marker ( Black )', 'Camlin Permanent Marker, Plastic Body, Black - 7270016', 'MARKER PEN CELLO', 'Permanent Marker Pen 10 pcs - Luxor', 'Permanent Marker', 'Permanent Marker Black', 'Permanent Marker, Round Bullet Tip, Colour Black', 'Pen Marker Permanent - Black']"
100803050010,CAMLIN,"Camlin Permanent Marker, Plastic Body, Green - 7270175",PCS,20,32.35,17,1,32.35,17,28.13,16,28.13,16,23.33,15,GST-12,5285,"['Camlin Permanent Marker, Plastic Body, Green - 7270175']","['Camlin Permanent Marker, Plastic Body, Green - 7270175', 'Pen Marker Permanent - Green', 'PERMANENT MARKER GREEN', 'Permanent Marker - Green', 'Permanent Marker Green', 'Parmanent Marker']"
100803050011,CAMLIN,"Camlin Permanent Marker, Plastic Body, Red - 7270369",PCS,20,32.35,17,1,32.35,17,28.13,16,28.13,16,23.33,15,GST-12,14893,"['Camlin Permanent Marker, Plastic Body, Red - 7270369']","['MARKER PEN LUXER', 'Permanent Marker Red', 'PERMANENT MARKER RED', 'Pen Marker Permanent - Red', 'Camlin Permanent Marker, Plastic Body, Red - 7270369', 'Luxor Permanent Marker (1 Pkt =10 Pcs )', 'PERMANENT MARKER']"
100803050009,CAMLIN,"Camlin Permanent Marker, Plastic Body, Blue - 7270018",PCS,20,32.35,17,1,32.35,17,28.13,16,28.13,16,23.33,15,GST-12,59446,"['Camlin Permanent Marker, Plastic Body, Blue - 7270018']","['MARKER PEN CAMLIN', 'Camlin Permanent Marker, Plastic Body, Blue - 7270018', 'WHITE BOARD REFILLABLE MARKER,COLOR:BLUE,BLACK,MAKE:RORITO', 'Permanent marker big Blue', 'Permanent Marker - Blue', 'Permanent Marker, Round Bullet Tip, Colour Blue', 'Permanent Marker Blue', 'PERMANENT MARKER BLUE', 'Camlin Permanent Marker, Plastic Body, Blue - 7270018 (Nos)', 'Pen Marker Permanent - Blue', 'Permanent Marker ( Blue )']"
100803060111,WORKSTORE,"SF50001, White Board Marker, RRed",PCS,30,62.5,24,1,55,20,47.06,17,43.75,16,40,15,GST-12,33475,"['SF50001, White Board Marker, RRed']","['SF50001, White Board Marker, RRed', 'White Board Marker (Red)', '7. Bord Markar Red,Green,Blue', 'White Board Marker (RED)', 'SF50001, White Board Marker, Red', 'White Board Marker, Red (NOS)', 'White Board Marker Red', 'Red Marker', 'White Board Marker (Red) - Luxor', 'Artline Xylene Free White Board Red Marker(Pack of 10) (PAC)']"
100803060112,WORKSTORE,"SF50002, White Board Marker, Blue",PCS,30,62.5,24,1,55,20,47.06,17,43.75,16,40,15,GST-12,73915,"['SF50002, White Board Marker, Blue']","['Board Markee', 'White Board Marker blue (Set of 10, Black)', 'Artline Xylene Free White Board Blue Marker(Pack of 10) (PAC)', 'White Board Marker ( ADD GEL ) - Black - 5847 / Blue - 5848 / Green - 5875 / Red – 5849', 'Board Marker', 'White Board Markers\n - Blue / Black / Green\n / Red', 'WB MARKER BLACK-LUXOR', 'White Board Marker (Blue) - Luxor', 'White Board Markers 10 Nos per box', 'WHITE BOARD MAKER BLUE LUXER', 'White Board Marker Blue', 'SF50002, White Board Marker, Blue', 'White Board Marker (1 Pkt = 10 Pcs )', 'WHITE BOARD MARKER', 'White board marker - Blue', 'WHITE BOARD MARKER BLACK CELIO', 'W/B MARKER Red,Blue,Black', 'White Board Marker, Blue (NOS)', 'Board Marker Pen', 'White Board Marker (Blue)', 'Whiteboard Marker', 'Blue Marker', 'FEVI STICK,8 GRM,MAKE,CAMLIN', 'White Board Marker Luxor', 'White Board Marker-Luxor', 'Board markers', 'White Board Marker']"
100803060113,WORKSTORE,"SF50003, White Board Marker, Green",PCS,30,62.5,24,1,55,20,47.06,17,43.75,16,40,15,GST-12,29486,"['SF50003, White Board Marker, Green']","['White Board Marker (Green)- Luxor', 'White Board Marker Green', 'Artline Xylene Free White Board Green Marker(Pack of 10) (PAC)', 'Green Marker', 'White Board Marker, Green (NOS)', 'SF50003, White Board Marker, Green']"
100803060114,WORKSTORE,"SF50004, White Board Marker, Black",PCS,30,62.5,24,1,55,20,47.06,17,43.75,16,40,15,GST-12,127033,"['SF50004, White Board Marker, Black']","['SF50004, White Board Marker, Black', 'White Board Marker (Black) - Luxor', 'White Board Marker Black (Set of 10, Black)', 'WB MARKER BK-ADD', 'Artline Xylene Free White Board Black Marker(Pack of 10) (PAC)', 'White Board Marker (BLACK)', 'White Board Marker Black', 'White Board Marker, Black (NOS)', 'White Board Marker (Black)', 'Black Marker']"
100803060002,CAMLIN,"Camlin White Board Marker, Plastic Body, Black - 7268016",PCS,28,38,25,1,38,25,35.42,24,29.55,22,22.5,20,GST-12,55854,"['Camlin White Board Marker, Plastic Body, Black - 7268016']","['WHITE BOARD MARKER RED CAMLIN', 'Camlin White Board Marker, Plastic Body, Black - 7268016 (Nos)', 'Camlin White Board Marker, Plastic Body, Black - 7268016', 'Camlim White Board Marker', 'Whiteboard Marker, Round Bullet Tip, Colour Black', 'Camlin Whiteboard Marker (Black) - (Pack of 10)', 'White Board Marker - Black', 'White board marker Black Pen']"
100803060003,CAMLIN,"Camlin White Board Marker, Plastic Body, Blue - 7268018",PCS,28,38,25,1,38,25,35.42,24,29.55,22,22.5,20,GST-12,39705,"['Camlin White Board Marker, Plastic Body, Blue - 7268018']","['Camlin White Board Marker, Plastic Body, Blue - 7268018', 'W/B MARKER', 'WHITE BOARD MARKER', 'Camlin White Board Marker, Plastic Body, All colors', 'White Board Marker ( Blue )', 'White Board Marker - Blue', 'White Board Marker', 'Camlin White Board Marker, Plastic Body, Blue - 7268018 (Nos)', 'White Board Marker cello make(1PAC=10NO)', 'Camlin Whiteboard Marker (Blue) - (Pack of 10)']"
100803060004,CAMLIN,"Camlin White Board Marker, Plastic Body, Green - 7268175",PCS,28,38,25,1,38,25,35.42,24,29.55,22,22.5,20,GST-12,24223,"['Camlin White Board Marker, Plastic Body, Green - 7268175']","['Camlin White Board Marker, Plastic Body, Green - 7268175 (Nos)', 'Camlin White Board Marker, Plastic Body, Green - 7268175', 'White Board Marker - Green', 'Camlin Whiteboard Marker (Green) - (Pack of 10)']"
100803060005,CAMLIN,"Camlin White Board Marker, Plastic Body, Red - 7268369",PCS,28,38,25,1,38,25,35.42,24,29.55,22,22.5,20,GST-12,22756,"['Camlin White Board Marker, Plastic Body, Red - 7268369']","['Camlin White Board Marker, Plastic Body, Red - 7268369 (Nos)', '2. White Board :-Marker Red :- 50 No', 'Camlin White Board Marker, Plastic Body, Red - 7268369', 'White board marker Red Pen', 'White Board Marker - Red', 'Camlin Whiteboard Marker (Red) - (Pack of 10)']"
100806100002,LUXOR,"921 Luxor Sign Pen, Fine Tip, Black, 10 Pc/Pack",PACK,120,26.53,98,10,26.53,98,24.21,95,24.21,95,20,90,GST-12,1595,"['LUXOR 921 SIGN PEN, FINE TIP, BLACK, (PACK OF 10 )', '921 Luxor Sign Pen, Fine Tip, Black, 10 Pc/Pack']","['LUXOR 921 SIGN PEN, FINE TIP, BLACK, (PACK OF 10 )', 'Luxor sign Pens ( Multiple colors)', '921 Luxor Sign Pen, Fine Tip, Black, 10 Pc/Pack', '921 Luxor Sign Pen, Fine Tip, Black, 10 Pc/Pack (PAC)']"
100806100003,LUXOR,"921 Luxor Sign Pen, Fine Tip, Blue, 10 Pc/Pack",PACK,120,26.53,98,10,26.53,98,24.21,95,24.21,95,20,90,GST-12,1696,"['921 Luxor Sign Pen, Fine Tip, Blue, 10 Pc/Pack', 'LUXOR 921 SIGN PEN, FINE TIP, BLUE,(PACK OF 10)']","['921 Luxor Sign Pen, Fine Tip, Blue, 10 Pc/Pack', '921 Luxor Sign Pen, Fine Tip, Blue, 10 Pc/Pack (PAC)']"
100202010153,WORKSTORE,Workstore ST1955 Binder Clip 19MM,PACK,29,34.78,23,1,34.78,23,31.82,22,31.82,22,25,20,GST-28,9884,"['Workstore ST1955 Binder Clip 19MM', 'Workstore ST-1955 BINDER CLIP 19MM']","['Binder Clip Box (19 MM)', 'BINDER CLIP 19 MM, PACK OF 12', 'BINDER CLIP 19MM', 'Binder Clips 19mm', 'Clips Binder 19mm Gorilla', 'Binder Clip 19MM (PAC)', 'BINDER CLIP 19 MM - INFINITY', 'Dash Binder Clips (19 mm) - 12 pcs. (Unit)', '19 MM Binder Clips', 'Metal Binder Clips, Size 19 mm', 'Binder Clip 19MM', 'STATIONERY,CLIP,19MM,12PCS', 'Binder Clip', 'Binder Clip 19 mm', 'Binder Clip 19mm Karni', 'BINDER CLIP 19MM Pack of 12 pcs', 'BINDER CLIP 20 MM', 'Binder Clips [ 19 mm ] (boxes)', 'Workstore ST1955 Binder Clip 19MM', 'BINDER CLIPS 19MM']"
